<!-- XML -->
<!ELEMENT UDML (filetype, separators, units, dates)>
<!ELEMENT filetype (#PCDATA)>
<!ELEMENT separators (sep+)>
<!ELEMENT sep (#PCDATA)>
<!ATTLIST sep isDecimal CDATA #REQUIRED>


<!ELEMENT units (unit+)>
<!ELEMENT unit (#PCDATA)>
<!ATTLIST unit type CDATA #REQUIRED>
<!ATTLIST unit multiplier CDATA #REQUIRED>

<!ELEMENT dates (date+)>
<!ELEMENT date (#PCDATA)>
